https://www.zhihu.com/question/22898278	一个很普通的大学女生，长的不丑，但是自己总会有自卑感作祟，想快速提升自己的气质或者气场，能给我好的建议或者意见吗？
https://www.zhihu.com/question/24600058	除了 Discuz 之外, 有哪些不错的开源论坛系统? 各有什么优劣? 谢谢.
https://www.zhihu.com/question/266845010	仅仅是因为 PDF 是 Adobe 家的有专利吗？
https://www.zhihu.com/question/268565724	世界卫生组织的报告显示，日本是全世界肥胖率最低的国家之一，并且是发达国家中肥胖率最低的国家，2016 年约是 4%。即便是以浪漫优雅、精致苛刻著称的法国，肥胖率也有 11%，美国则高达 32%。 常常看日本电影电视剧的人不难发现，日本的明星演员都非常瘦。现实生活中，但凡有外国人来到日本，都会惊呼说：「日本街头几乎看不到胖子！」 有趣的是，日本人却并不爱运动，普遍没有健身习惯。根据医学期刊《The Lancet》调查「全球最不爱运动的国家」，日本排到第十一名，全国有超过 60% 的人参与运动的积极度都是在平均水平以下。全球最爱运动的国家是美国，全国有超过 40% 的人参与运动的积极度都在高水平以上。为什么不喜欢运动的日本人却是全球最瘦？
https://www.zhihu.com/question/308920265	有意向考研并且喜欢西南政法大学，导师建议我们读一些书，想多了解法学有什么有意思的入门书籍推荐吗？而且对于考研有什么建议吗？ 谢谢各位啦
https://www.zhihu.com/question/316754604	应该从哪些史书入手？顺序是如何？
https://www.zhihu.com/question/340223529	观察到的一个现象是程序员职业的幸福度是相当低的，极大部分人都是普通人，都在做着损耗身体，重复性的搬砖活动。缺少了情感交流，色彩化，加之高压下抑制创造性发挥，职业规格和市场现状就是反人类的，终究来说，像机器一样思考是极少数人能做到的事，而大部分人会被各种外力不断冲击，也就是为了一笔钱而已，也只能不断麻痹着自己去提升技术，热爱工作。 那么如果你有了足够的钱，你还想做程序员吗？你又想做什么自己真心想做的事情呢？请说出你的故事。
https://www.zhihu.com/question/34336738	男，19 岁学生党，皮肤夏天天热时爱出油，冬天偏干，比较黑，想美白，求推荐护肤产品，基本要求洗的干净不紧绷，预算有限 300 元左右
https://www.zhihu.com/question/363285780	都说发烧会烧坏脑子，如果单独保护大脑对全身升温，可以有效杀死癌细胞痊愈吗？ 这样做是不是会留下后遗症？还是说大脑是无法在全身升温的情况下独立散热保护？
https://www.zhihu.com/question/42662696	辩论时总会遇到双方互相丢事例和数据的情况，那么请问：1. 当双方只是单纯丢事例数据并没深入挖掘事例数据的时候，怎么拆呢？（啊貌似这个有点蠢然而还是不会拆呵呵呵） 2. 当双方挖深了事例数据互相丢的时候，怎么拆呢？ 拆事例和拆数据... 问题如题
https://www.zhihu.com/question/451537118	这是美国一个大学的物理学考试题目，RWP for Exam 1 - Stealing Power
https://www.zhihu.com/question/469423833	学习摄影有段时间了，一直在网上搜索调色教程，可是看完还是晕乎乎的，请问如何学习调色（人像和风光调色都想学习）
https://www.zhihu.com/question/479791391	一些很老的系统（比如 Windows2000 以下的系统）现在几乎没有人用了。现在就算是 XP 除了一些特殊情况外就真的没怎么看到过，基本上现在操作系统不是 Windows7 就是 10。题主 Windows Sever 2019 系统，是因为讨厌 Windows10 自带的乱七八糟的服务才用的。所以说 2000 以下的老系统几乎没有任何商业价值了，为何不开源供大家研究源代码？
https://www.zhihu.com/question/48493199	题主是一枚准高一狗，想考雅思，想得 8 分（认真脸） 现在正在进行盲目学习... 因为摸不清套路不知该从何开始学，向各位大神求助 谢谢～
https://www.zhihu.com/question/490301294	伊尔 2 是专职的对地攻击机，使用机炮、火箭弹和炸弹进行空中支援。P47 主要是护航战斗机，但是由于机型庞大坚固，也可以挂载火箭和炸弹对地攻击，但是固定武器只有机枪。 那么综合考虑两者的性能数据以及各自在实际运用中的表现，伊尔 2 和 P47 哪个更适合执行近距离空中对地支援呢？
https://www.zhihu.com/question/506234289	考不上我打算边工作边二战的，也不知道今年有必要为了成绩能好看一点继续准备一战还是要现在开始准备二战了。这一年花了挺多时间却好像什么也没学好，基础打的特别差，单词背的也忘得差不多了。九月份换的专业课前几天才学完，数学真题一套都没写完。九月份就想着二战的，结果前几天心态崩了，现在好了点，但还是很迷茫 。六级考了好多次也没过，这次也应该一样。
https://www.zhihu.com/question/525485662	年轻人装修，除了注重追求实用性和舒适感，当然也要兼具美感，除了当前大火的侘寂风，新中式风，还有哪些家装产品趋势值得关注？如何给自己打造一个既能凹造型拍大片，又能享受智能感和强功能性的舒适新家，欢迎来分享~
https://www.zhihu.com/question/530400161	大部分同学，看着每天忙忙碌碌，上课下课写题。但是我也不知道他们在干嘛，我问他们毕业了想干什么工作，他们也都支支吾吾，虽然可能有部分人是知道自己该干嘛，只是不愿意回答。但是我看来，大部分同学是真的不知道自己想干嘛。 为一个大一双非一本，家庭条件一般的大学生。我发现学校教的很多课程，都和真实的工作岗位没有关系。学生们都不清楚自己以后该去哪里就业。
https://www.zhihu.com/question/530803093	曹则贤教授曾在演讲中提到，数学物理有 85% 的知识未传入中国，但我对这个观点表示疑惑，有大佬解释下么？ 中科院曹则贤：这个世界上有 85% 的数学物理都没传到中国，网友：大部分人都用不到#教育 #思维
https://www.zhihu.com/question/543965236	淘宝京东天猫双十二活动什么时候开始呀？
https://www.zhihu.com/question/545195950	今天有个上小学的孩子问我：既然用手机打拼音就能变成汉字了，那为什么有的汉字不能只用拼音？ 有人知道这个原因吗？求解
https://www.zhihu.com/question/551171367	当孩子逐渐长大开始独立思考，发现社会的游戏规则跟我，书本，老师教导他的不一样，质疑我的时候该怎么办?
https://www.zhihu.com/question/560271173	刚上大学，大学的数学专业课有《空间解析几何》《高等代数》和《数学分析》三个；其中数学分析最让我不能接受。它在试图将一切人话，转化成数学语言，这在我看来这是没有必要的行为。我想能不能抛开《数分》(尽量不花精力在这本书上，不跟学校走)，做自己喜欢的事，只研究自己感兴趣的数学？公理化和严谨确实是好事，但这不是我的追求。
https://www.zhihu.com/question/562421408	想换一款吹风机。求助万能的知友们分享一些选购标准，以及推荐一些适合女生使用的款型，感激不尽！对了，预算最好控制在 500 以内~
https://www.zhihu.com/question/563451357	耐克 blazer Vans 匡威这些经典板鞋觉得都很好看，但是不知道哪款走路舒服，本人膝盖有伤。。求大神指导
https://www.zhihu.com/question/563475464	市面上常见的复式洗衣机的上筒容量一般是 4-5kg，似乎多加 1kg 的容量也不是什么难事，但为什么目前就只有 TCL 做出了 6kg 上筒容量的复式洗衣机呢？最符合分区洗衣需求的上筒容量又是多少呢？
https://www.zhihu.com/question/563491189	我家里免费升级了宽带，但是老路由器信号一直都不好，想换台 WIFI6 的路由。网上看了一下现在的路由不光能上网还可以给游戏加速，挂着赚积分收益？实在不知道如何选择，请各位大佬们帮我答疑解惑吧！
https://www.zhihu.com/question/564233941	谢谢各位有经验的朋友回答下，男士，30 岁，想维持一下身材不求增肌
https://www.zhihu.com/question/565190503	2022 年是不是国内 MPV 井喷元年？油、混、纯电，传统品牌、新势力 MPV 新车频发发布，在国内 MPV 会成为继 SUV 之后的下一个车型爆点吗？
https://www.zhihu.com/question/565198687	猫咪很能吃，越来越胖，喂猫的时候猫咪会不会自己想减肥，少吃一些。
https://www.zhihu.com/question/566827315	世界杯火热开赛，谁是你心中的冠军队伍？快去为你支持的球队助威吧！2022.11.18-12.18 世界杯期间，参与球队助威，即有机会瓜分盐粒奖池。助威次数越多，助威球队每场获胜后瓜分赢取的盐粒越多。每日达成任务成就还可获得额外创作分奖励，加速获得助威次数。点击下方链接，马上去助威吧>>> 为你支持的球队助威，赢知乎盐粒
https://www.zhihu.com/question/567183334	世界杯火热开赛，谁是你心中的冠军队伍？快去为你支持的球队助威吧！2022.11.18-12.18 世界杯期间，参与球队助威，即有机会瓜分盐粒奖池。助威次数越多，助威球队每场获胜后瓜分赢取的盐粒越多。每日达成任务成就还可获得额外创作分奖励，加速获得助威次数。点击下方链接，马上去助威吧>>> 为你支持的球队助威，赢知乎盐粒
https://www.zhihu.com/question/567656906	世界杯火热开赛，谁是你心中的冠军队伍？快去为你支持的球队助威吧！2022.11.18-12.18 世界杯期间，参与球队助威，即有机会瓜分盐粒奖池。助威次数越多，助威球队每场获胜后瓜分赢取的盐粒越多。每日达成任务成就还可获得额外创作分奖励，加速获得助威次数。点击下方链接，马上去助威吧！ 为你支持的球队助威，赢知乎盐粒>>>
https://www.zhihu.com/question/567962401	各种资源相比，卡塔尔跟日本都有数量级的差距，为什么日本要跟韩国合办，而卡塔尔自己就可以办了？
https://www.zhihu.com/question/567990839	最近看新闻说个人养老金要进入股市，但是我从来没听说过个人养老金，只知道社保中的养老金，这个个人养老金是不是很少人会去交，而且存进个人养老金的账户就不能取出来了，那和我自己每个月存点钱有什么区别呢？
https://www.zhihu.com/question/568032338	本人高二在校生，学校要求十点半睡觉
https://www.zhihu.com/question/568136397	比如现在的足球世界杯，很多人都认为日本有可能打败德国，或者战平！沙特有可能打赢或者打平阿根廷！其实日本，沙特足球排名比德国，阿根廷差的远！！……但篮球世界杯，如果一个明显强队，比如阿根廷 vs 沙特，那基本上一边倒认为阿根廷回赢，沙特不可能赢。这是为啥呢？ 世界杯火热开赛，谁是你心中的冠军队伍？快去为你支持的球队助威吧！2022.11.18-12.18 世界杯期间，参与球队助威，即有机会瓜分盐粒奖池。助威次数越多，助威球队每场获胜后瓜分赢取的盐粒越多。每日达成任务成就还可获得额外创作分奖励，加速获得助威次数。点击下方链接，马上去助威吧>>> 为你支持的球队助威，赢知乎盐粒
https://www.zhihu.com/question/568411928	明年打算入手一辆新能源车。欢迎各位畅所欲言。
https://www.zhihu.com/question/568449405	输了韩国又输日本，德国队的症结到底在哪里？ 世界杯火热开赛，谁是你心中的冠军队伍？快去为你支持的球队助威吧！2022.11.18-12.18 世界杯期间，参与球队助威，即有机会瓜分盐粒奖池。助威次数越多，助威球队每场获胜后瓜分赢取的盐粒越多。每日达成任务成就还可获得额外创作分奖励，加速获得助威次数。点击下方链接，马上去助威吧>>> 为你支持的球队助威，赢知乎盐粒
https://www.zhihu.com/question/568587451	Crush 指「短暂地、热烈地但又是羞涩地爱恋」 如何与 Crush 建立有效连接？
https://www.zhihu.com/question/568770778	对于多数太空史诗而言，星门不管具体原理如何，都采用了类似于虫洞对的瞬时传送系统，在假设这种航行方式，并不违反爱因斯坦定理（比如折叠空间来进行超光速航行)，或者当已经提出了比爱因斯坦原理更进一步的物理定律（亚空间 / 高维航行 / 快子航行等等），使得星门是可以量产并且规模应用的。 在此基础上去评估他对一个星际帝国的影响，应该如何分析？可以对比现实中的哪种交通方式？港口还是火车站？ @赵泠
https://www.zhihu.com/question/568773549	例: 人工智能学到最后都是数学; 人工智能的本质就是数学; 经济学的本质就是数学; \cdots
https://www.zhihu.com/question/568791838	ICLR 2023 开奖，扩散模型成为一大热门，且席卷很多方向。快到 2023 年了，扩散模型还有什么方向可做的呢
https://www.zhihu.com/question/568832709	财联社 11 月 25 日电，法国外交部长凯瑟琳 · 科隆纳 ( Catherine Colonna ) 表示，法国将向乌克兰运送 100 台超大功率发电机。据乌克兰媒体报道，红十字国际委员会已向哈尔科夫地区运送了十台重型发电机。 法国向乌克兰运送 100 台超大功率发电机
https://www.zhihu.com/question/568993936	曾经我和他是非常要好的朋友，可是现在，也不知道发生了什么，他慢慢不主动联系我了，我给他发信息也总是敷衍我。起初以为他只是变的稳重，变的成熟，可是现在我发现，他会主动的去找别人聊天，但不会来找我
https://www.zhihu.com/question/569024071	哪一种思想对你的数学生涯影响最深呢？
https://www.zhihu.com/question/569026423	在寝室学不进去难道不是自己的原因吗? 感觉不去图书馆就是不爱学习，我就不喜欢图书馆里面那种压抑的感觉，在寝室学习反而感觉很轻松，学习的时间也更久
https://www.zhihu.com/question/569137722	就算孙悟空对这些不感兴趣，但也应该有很多女的喜欢他呀，为什么一个个都追着唐僧
https://www.zhihu.com/question/569139929	财联社 11 月 26 日电，当地时间周五（11 月 25 日），荷兰外贸与发展合作大臣莉谢·施赖纳马赫尔表示，荷兰正与美国政府就关于向中国出口光刻机的新限制进行谈判。自 2018 年以来，在美国的压力之下，荷兰政府一直禁止阿斯麦向中国出口其最先进的极紫外线光刻机（EUV），但仍可以销售上一代的深紫外线光刻机（DUV）。然而，美国希望进一步打压中国芯片行业，将 DUV 也纳入禁售范围。施赖纳马赫尔称：「我们正与美国进行谈判，显然他们已经宣布了单方面措施。我无法评论荷兰将接受什么，我们在权衡自己的利益，我们的公司已经受到（以前的）出口限制的损害。」
https://www.zhihu.com/question/569147822	大一已经过半，还是不能静下心好好学，想知道大家大学生活是如何度过的？
https://www.zhihu.com/question/569186955	中国足球职业联赛夏季转会窗口将于 8 月 1 日打开，国内足坛今夏最受关注的转会消息已经爆出——2019 年 1 月由上海海港加盟西甲西班牙人的武磊将结束留洋生涯，回归上海海港征战中超联赛。2021-2022 赛季西甲联赛于北京时间 5 月 23 日落幕，西班牙人收官战客场战平格拉纳达后，武磊曾在社交平台上发文，「这几年连轴转，身心俱疲，接下来真的要好好休息放松一下，7 月继续。」当时在外界看来，尽管武磊这个赛季出场机会寥寥，但依然会选择坚守。毕竟「鹦鹉军团」做了较大调整，球队主教练和体育总监均出现变动，武磊被认为有机会重新竞争上岗。 西班牙人的新赛季备战已开始了近一个月，武磊第二周就遇到膝伤，未随队参加马贝拉集训。当地时间 7 月 27 日，西班牙媒体报道了武磊的转会动向——武磊、西班牙人和上海海港的转会谈判已经开启。据悉，与西班牙人合同 2024 年 6 月到期的武磊出于家庭因素考虑，计划提前结束留洋生涯。 本赛季中超前 10 轮，上海海港的战绩并不理想，暂列积分榜第 6 位。武磊正是球队需要的补强人选，毕竟外援穆伊已经离队，奥斯卡归来的前景也极不乐观。 据新京报记者了解，三方谈判仍在进行中，如果不出意外的话，武磊将在今年中超夏窗重返上海海港。出于家庭因素考虑，武磊将结束留洋重返中超 周三，德甲豪门拜仁官方宣布，已经签下了日本 18 岁中场球员福井太智，他将在明年正式加入拜仁，不过先从二队踢起。如果他在拜仁踢上德甲，那他将成为本赛季第 10 位在德甲踢球的日本球员。 日本队目前在国际足联排名第 24 位，据统计，目前欧洲五大联赛已经有 16 名日本球员。 其中在英超 2 人，他们效力阿森纳的富安健洋、效力布莱顿的三笘薫。法甲有川岛永嗣、奥奈武 - 阿道、伊东纯也、南野拓实。而德甲最多，达到了 9 人，他们是镰田大地、长谷部诚、远藤航、伊藤洋辉、吉田麻也、原口元气、堂安律、浅野拓磨、板仓滉。如果福井太智也上演德甲首秀，那日本的德甲球员将有 10 人。 另一方面，国际足联排名第 28 位的韩国，也有 7 名球员效力于五大联赛，其中英超有热刺的孙兴慜、狼队的黄喜灿。西甲有马洛卡的李刚仁，意甲有那不勒斯的金珉载，德甲有柏林赫塔的李东俊，美因茨的李在成，弗莱堡的郑优营。五大联赛球员数量：日本 16 人韩国 7 人 国足 0 人 世界杯火热开赛，谁是你心中的冠军队伍？快去为你支持的球队助威吧！2022.11.18-12.18 世界杯期间，参与球队助威，即有机会瓜分盐粒奖池。助威次数越多，助威球队每场获胜后瓜分赢取的盐粒越多。每日达成任务成就还可获得额外创作分奖励，加速获得助威次数。点击下方链接，马上去助威吧>>>
https://www.zhihu.com/question/569188601	11 月 26 日，中超联赛第 27 轮上演焦点战，广州队在晋江体育中心体育场以 1 比 1 战平河南嵩山龙门队。目前广州队与广州城队同积 15 分，以两个净胜球优势在积分榜上反超广州城队，排名联赛第 15 名，暂时脱离降级区。 赛前，保级竞争对手武汉长江因欠薪被扣 6 分，广州队排名升至第 16 位。 韦世豪、杨立瑜、艾菲尔丁组成广州队首发锋线三叉戟，老将蒿俊闵、黄博文、张成林因伤再次缺席大名单。 上半时，河南队王上源、阿德里安相继制造险情，但广州队门将刘世博力保城门不失，多次做出关键扑救，双方互交白卷进入下半时。 第 53 分钟，广州队右后卫陈泉江提前卡住身位，造成阿德里安禁区内犯规，韦世豪主罚点球命中。 第 65 分钟，河南队杨帅在禁区内手球，主裁回看视频回放后认定其手臂处于自然状态，不构成点球。 第 73 分钟，王上源右路送出助攻、黄紫昌头球破门，河南队扳平比分。临近终场，广州队又被吓出一身冷汗：卡兰加禁区转身、近距离打门，刘世博再次立功，为球队守住关键 1 分。 本场比赛，刘世博贡献了 7 次扑救，获评 8.6 的高分。赛后，他在接受采访时表示，这只是自己应该完成的任务，球队困难时自己需要站出来。 广州队技术总监傅博认为，虽然平局对球队来说很遗憾，但这 1 分很宝贵。「年轻球员取得不小的进步，比赛中越来越投入，是一个好的迹象」。【中超】广州队与河南队握手言和，暂时脱离降级区 2021 年下半年开始，广州足球俱乐部的大股东恒大集团遭遇经营困境，俱乐部也受到影响。由此可以看出，广州足球俱乐部将把「紧缩银根」落实到极致的程度。而此举在整个国内职业足球行业圈里或许带有相当的风向标色彩。 广州足球俱乐部官网显示，2010 年 3 月 1 日，恒大集团以一亿元买断广州足球俱乐部全部股权，俱乐部正式更名为广州恒大足球俱乐部。 2014 赛季，阿里巴巴集团增资扩股广州恒大足球俱乐部，广州恒大队更名为广州恒大淘宝队。 2015 年，广州恒大淘宝大队挂牌新三板，成为亚洲第一支上市的足球俱乐部队。 截至 2020 年底退市， 恒大淘宝俱乐部的市值曾一度高达 190.4 亿元，为新三板总市值排名第三的公司。 公司公告显示，2015 年 -2019 年，恒大淘宝俱乐部净利润分别亏损 9.52 亿元、 8.12 亿元、 9.86 亿元、 18.29 亿元和 19.4 亿元。 而因为持续亏损， 恒大淘宝 俱乐部在 2018 年 5 月 3 日「戴帽」成为 ST 恒宝 ，被实施风险警示。 恒大淘宝 俱乐部也曾多次在年报中提及，球员资源是公司目前最大的采购项目，但由于引进教练和球员的转会费及薪酬成本较高，导致公司成本居高不下，继而多年处于亏损状态。 2020 年 12 月 19 日，恒大淘宝申请在新三板终止挂牌。 2021 年 1 月，俱乐部正式更名为广州足球俱乐部，简称为「广州队」，并于 2021 年 3 月正式摘牌。大幅降薪！广州队一线队球员年薪最低仅 6 万元，封顶 60 万！与 5 名归化球员终止合约 | 每经网
https://www.zhihu.com/question/569318650	看到岚图对撞埃尔法的结果，有钱人还会买埃尔法吗？
https://www.zhihu.com/question/569319581	据中国载人航天工程办公室消息，在载人飞船与空间站组合体成功实现自主快速交会对接后，神舟十五号航天员乘组从飞船返回舱进入轨道舱。完成各项准备后，北京时间 2022 年 11 月 30 日 7 时 33 分，翘盼已久的神舟十四号航天员乘组顺利打开「家门」，神舟十五号航天员乘组费俊龙、邓清明和张陆「到家」。 「神舟十五号，中国‘太空家园’的大门已经为你们打开。」神舟十四号乘组指令长陈冬打开节点舱舱门后，激动地说。 在节点舱，两乘组的指令长率先会面，陈冬与费俊龙先是握手，随后紧紧拥抱，热情欢迎远道而来的亲人入驻「天宫」。邓清明、张陆也陆续走进「家门」，与在核心舱内等待的刘洋、蔡旭哲握手拥抱。六名中国航天员在天和核心舱内顺利会师，并一起在中国人自己的「太空家园」里留下了一张足以载入史册的太空合影，「中国空间站，永远值得期待！」 后续，两个航天员乘组将在空间站进行首次在轨轮换。期间，6 名航天员将共同在空间站工作生活约 5 天时间，完成各项既定任务和交接工作。 据中国载人航天工程办公室消息，神舟十五号载人飞船入轨后，于北京时间 2022 年 11 月 30 日 5 时 42 分，成功对接于空间站天和核心舱前向端口，整个对接过程历时约 6.5 小时。 按任务计划，3 名航天员随后将从神舟十五号载人飞船进入天和核心舱。神舟十四号航天员乘组已做好迎接神舟十五号航天员乘组进驻各项准备工作，这也是中国航天员首次在空间站迎接载人飞船来访。 搭载神舟十五号载人飞船的长征二号 F 遥十五运载火箭在酒泉卫星发射中心点火发射，3 名航天员踏上飞天圆梦之旅。这次「出差」他们将进行哪些任务？
https://www.zhihu.com/question/569322295	从销量上看，RTX 4080 有点失败，有统计显示发售以来的销量只有 RTX 4090 的大约 1/3.4，而且一直在下滑，溢价幅度也远不如 RTX 4090。 这种局面只能怪定价太高，比上一代 RTX 3080 贵了超过 70％，但是平均性能提升只有 30-50％。在国内，RTX 4080 有一些「丐版」型号确实卖着 9499 元的官方建议零售价，而在欧洲，「破发」已经出现了。 德国电商平台上，耕升的 RTX 4080 Phantom 版本的价格从 1539 欧元降到了 1449 欧元，低于建议零售价 1469 欧元。虽然只差区区 20 欧元，但这显然是个信号，更多「破发」可能就在路上。价格暴降 24％！销量扑街的 RTX4080 第一次破发了
https://www.zhihu.com/question/569325418	11 月 27 日，蔚来创始人李斌在东莞松山湖蔚来牛屋与用户进行了面对面谈话。有博主整理了比较重要的发言内容。李斌称，40 万以上纯电车，中国 100 个用户里面有 73 个用户选择了蔚来。之前有一位用户三年开了 45 万公里，蔚来收购回来做了质量测试，发现三年时间可以帮用户省出一辆 BBA。 李斌：蔚来手机在上海和深圳都有团队，进展比较顺利
